Posizione,ID_Giocatore,Nome_Giocatore,Nazionalità,Team_Pokémon
1,1616,Zackary Thornberg,USA,"Flutter Mane, Maushold, Annihilape, Scream Tail, Ting-Lu, Talonflame"
2,382,Sohaib Mufti,USA,"Flutter Mane, Amoonguss, Arcanine, Iron Bundle, Kingambit, Iron Hands"
3,185,Brandon Tuchtenhagen,USA,"Flutter Mane, Amoonguss, Arcanine, Azumarill, Ting-Lu, Roaring Moon"
4,2126,Kenneth Tirado,Puerto Rico,"Flutter Mane, Maushold, Ceruledge, Palafin, Iron Jugulis, Iron Hands"
5,696,Michael Abdelmessih,Australia,"Flutter Mane, Amoonguss, Arcanine, Iron Bundle, Kingambit, Iron Hands"
6,1604,Nishant Joshi,USA,"Flutter Mane, Amoonguss, Arcanine, Palafin, Ting-Lu, Roaring Moon"
7,1606,Jonathan Quiñones,Puerto Rico,"Female Indeedee, Amoonguss, Armarouge, Chien-Pao, Great Tusk, Gallade"
8,2411,Alexavier Álvarez,Puerto Rico,"Flutter Mane, Amoonguss, Chi-Yu, Gyarados, Ting-Lu, Iron Hands"
