Posizione,ID_Giocatore,Nome_Giocatore,Nazionalità,Team_Pokémon
1,130,Chuppa Cross IV,USA,"Chien-Pao, Rillaboom, Hisuian Arcanine, Rapid Strike Urshifu, Tornadus, Flutter Mane"
2,150,Paul Chua,USA,"Heatran, Iron Hands, Roaring Moon, Amoonguss, Flutter Mane, Landorus Therian"
3,351,Raghav Malaviya,USA,"Rapid Strike Urshifu, Tornadus, Regidrago, Rillaboom, Hisuian Arcanine, Gholdengo"
4,4,Jamie Boyt,Great Britain,"Roaring Moon, Ogerpon, Hisuian Arcanine, Rapid Strike Urshifu, Thundurus Therian, Gholdengo"
5,2172,Bobby Rochelle,USA,"Rapid Strike Urshifu, Hisuian Arcanine, Tornadus, Iron Hands, Sinistcha, Chien-Pao"
6,2146,Enzo Reci,USA,"Female Indeedee, Rapid Strike Urshifu, Bloodmoon Ursaluna, Tornadus, Armarouge, Flutter Mane"
7,2716,Andrew Krug,USA,"Dusclops, Cornerstone Mask Ogerpon, Chi-Yu, Iron Hands, Landorus Therian, Bloodmoon Ursaluna"
8,1932,Justin Tang,USA,"Salamence, Iron Hands, Gholdengo, Iron Bundle, Amoonguss, Pelipper"
9,2068,Carson Jones,USA,"Tornadus, Single Strike Urshifu, Dondozo, Glimmora, Flutter Mane, Tatsugiri"
10,2523,Zachary Weed,USA,"Rillaboom, Hisuian Arcanine, Rapid Strike Urshifu, Landorus Therian, Iron Bundle, Kingambit"
11,1170,Mattie Morgan,Ireland,"Flutter Mane, Wellspring Mask Ogerpon, Iron Hands, Clefairy, Kingambit, Landorus Therian"
12,1793,Nate Wright,Canada,"Landorus Therian, Iron Hands, Flutter Mane, Roaring Moon, Amoonguss, Heatran"
13,319,Gavin Michaels,USA,"Amoonguss, Pelipper, Iron Hands, Gholdengo, Salamence, Iron Bundle"
14,211,Grant Weldon,USA,"Tornadus, Flutter Mane, Farigiraf, Heatran, Single Strike Urshifu, Regidrago"
15,1277,Eric Bartlett,USA,"Hearthflame Mask Ogerpon, Rillaboom, Iron Hands, Heatran, Iron Bundle, Landorus Therian"
16,159,Riley Factura,USA,"Kingambit, Amoonguss, Rapid Strike Urshifu, Dragonite, Chien-Pao, Hearthflame Mask Ogerpon"
17,1142,Daravone Souphommanychanh,Canada,"Tornadus, Rapid Strike Urshifu, Gholdengo, Hisuian Arcanine, Wellspring Mask Ogerpon, Iron Hands"
18,2798,Elijah Gardner,Canada,"Sinistcha, Roaring Moon, Alolan Ninetales, Iron Hands, Armarouge, Female Indeedee"
19,2339,Tim Edwards,USA,"Chi-Yu, Dusclops, Iron Hands, Flutter Mane, Bloodmoon Ursaluna, Wellspring Mask Ogerpon"
20,1616,Zackary Thornberg,USA,"Okidogi, Scream Tail, Talonflame, Flutter Mane, Single Strike Urshifu, Hearthflame Mask Ogerpon"
21,343,Brian Youm,USA,"Chien-Pao, Dragonite, Farigiraf, Heatran, Rillaboom, Rapid Strike Urshifu"
22,1602,Tang Shiliang,China,"Salamence, Amoonguss, Iron Bundle, Iron Hands, Pelipper, Gholdengo"
23,2799,Jing Zhou,Canada,"Hisuian Arcanine, Gholdengo, Wellspring Mask Ogerpon, Iron Hands, Rapid Strike Urshifu, Tornadus"
24,2800,marc neuman,Canada,"Landorus Therian, Amoonguss, Iron Hands, Heatran, Flutter Mane, Single Strike Urshifu"
25,286,Kazuki Kanehira,USA,"Farigiraf, Dragonite, Rapid Strike Urshifu, Rillaboom, Heatran, Chien-Pao"
26,2556,Alexander DAndrea,USA,"Dondozo, Glimmora, Iron Hands, Tatsugiri, Hearthflame Mask Ogerpon, Alolan Ninetales"
27,1232,Jeremy Parson,USA,"Heatran, Dragonite, Rillaboom, Farigiraf, Rapid Strike Urshifu, Chien-Pao"
28,1028,James Evans,USA,"Clefairy, Iron Bundle, Dragonite, Gholdengo, Hisuian Arcanine, Rapid Strike Urshifu"
29,1810,Montana Mott,USA,"Chien-Pao, Flutter Mane, Rillaboom, Rapid Strike Urshifu, Hisuian Arcanine, Tornadus"
30,1949,Jimmy Friedle,USA,"Single Strike Urshifu, Sylveon, Iron Bundle, Hearthflame Mask Ogerpon, Landorus Therian, Tornadus"
31,338,Dylan Salvanera,USA,"Rillaboom, Gholdengo, Landorus Therian, Hearthflame Mask Ogerpon, Rapid Strike Urshifu, Tornadus"
32,2730,Maximilian Gorchels,USA,"Single Strike Urshifu, Dragonite, Ursaluna, Flutter Mane, Cresselia, Iron Hands"
33,26,Trista Medine,USA,"Chien-Pao, Rapid Strike Urshifu, Gholdengo, Dragonite, Hearthflame Mask Ogerpon, Amoonguss"
34,2354,Ollie Zilkha,USA,"Landorus Therian, Baxcalibur, Alolan Ninetales, Heatran, Rillaboom, Wellspring Mask Ogerpon"
35,394,Brendan Zheng,USA,"Rapid Strike Urshifu, Chien-Pao, Hisuian Goodra, Amoonguss, Iron Bundle, Dragonite"
36,1809,Austin Forcinito,USA,"Chien-Pao, Flutter Mane, Rapid Strike Urshifu, Tornadus, Hisuian Arcanine, Rillaboom"
37,2801,Michael Klymchuk,Canada,"Chien-Pao, Landorus Therian, Sinistcha, Iron Hands, Rapid Strike Urshifu, Heatran"
38,33,Eric Rios,Spain,"Hisuian Arcanine, Cresselia, Tyranitar, Rillaboom, Kommo-o, Flutter Mane"
39,1084,Andrew Ding,USA,"Hearthflame Mask Ogerpon, Tornadus, Rillaboom, Landorus Therian, Rapid Strike Urshifu, Flutter Mane"
40,2802,Jason Tang,USA,"Wellspring Mask Ogerpon, Landorus Therian, Rillaboom, Heatran, Iron Bundle, Iron Hands"
41,1473,Luhou Shen,USA,"Dusclops, Iron Hands, Galarian Moltres, Hisuian Arcanine, Sinistcha, Bloodmoon Ursaluna"
42,1462,Adrien Hurley,USA,"Hisuian Lilligant, Tatsugiri Stretchy Form, Female Indeedee, Torkoal, Armarouge, Dondozo"
43,1688,Abhay Iyer,N/A,"Hisuian Arcanine, Flutter Mane, Wellspring Mask Ogerpon, Kingambit, Landorus, Iron Hands"
44,2386,Parker Simmons,USA,"Annihilape, Landorus Therian, Hisuian Arcanine, Rillaboom, Iron Bundle, Wellspring Mask Ogerpon"
45,2803,Takuya Hiraiwa,USA,"Tornadus, Chien-Pao, Rillaboom, Flutter Mane, Single Strike Urshifu, Heatran"
46,2670,Brian Hough,USA,"Single Strike Urshifu, Landorus Therian, Flutter Mane, Iron Hands, Wellspring Mask Ogerpon, Heatran"
47,1611,Anders Nordstrom,USA,"Iron Hands, Dusclops, Hearthflame Mask Ogerpon, Single Strike Urshifu, Landorus Therian, Bloodmoon Ursaluna"
48,2400,Everett Filloon,USA,"Rillaboom, Chien-Pao, Rapid Strike Urshifu, Tornadus, Hisuian Arcanine, Flutter Mane"
49,2804,Jonathan Giron,USA,"Rapid Strike Urshifu, Tornadus, Amoonguss, Roaring Moon, Hisuian Arcanine, Tinkaton"
50,373,Nicholas Borghi,USA,"Gholdengo, Chien-Pao, Rapid Strike Urshifu, Clefairy, Rillaboom, Hearthflame Mask Ogerpon"
51,188,Alberto Lara,USA,"Flutter Mane, Amoonguss, Landorus Therian, Kingambit, Gastrodon, Heatran"
52,393,Ryan Tan,USA,"Landorus Therian, Bloodmoon Ursaluna, Rillaboom, Flutter Mane, Dusclops, Hearthflame Mask Ogerpon"
53,378,Abe Brath,USA,"Rapid Strike Urshifu, Tornadus, Regidrago, Gholdengo, Hisuian Arcanine, Rillaboom"
54,2805,Jonathan Lin,USA,"Iron Hands, Flutter Mane, Wellspring Mask Ogerpon, Heatran, Landorus Therian, Single Strike Urshifu"
55,2806,Jacob Wilkins,Canada,"Tornadus, Landorus Therian, Flutter Mane, Hearthflame Mask Ogerpon, Iron Hands, Chien-Pao"
56,2548,Robert McEachern,USA,"Female Indeedee, Gallade, Ursaluna, Single Strike Urshifu, Torkoal, Armarouge"
57,2321,Vincent Mateo,Philippines,"Wellspring Mask Ogerpon, Bloodmoon Ursaluna, Chi-Yu, Dusclops, Landorus Therian, Iron Hands"
58,2395,Tamkin Rahman,Canada,"Rapid Strike Urshifu, Iron Hands, Tornadus, Clefairy, Hisuian Arcanine, Gholdengo"
59,1267,Zach Carlson,USA,"Rillaboom, Flutter Mane, Tornadus, Chien-Pao, Hisuian Arcanine, Rapid Strike Urshifu"
60,1631,Jesse Romolo,Canada,"Dragonite, Rapid Strike Urshifu, Farigiraf, Rillaboom, Heatran, Chien-Pao"
61,2807,Anthony Kissoon,USA,"Rapid Strike Urshifu, Tornadus, Flutter Mane, Rillaboom, Landorus Therian, Hearthflame Mask Ogerpon"
62,1766,Luka Trejgut,USA,"Landorus Therian, Hearthflame Mask Ogerpon, Flutter Mane, Tornadus, Kingambit, Rapid Strike Urshifu"
63,195,Joshua Lorcy,USA,"Landorus Therian, Roaring Moon, Iron Hands, Amoonguss, Heatran, Flutter Mane"
64,1710,Camilo Liberona,Chile,"Hisuian Arcanine, Farigiraf, Iron Hands, Wellspring Mask Ogerpon, Alolan Ninetales, Galarian Moltres"
65,2334,Jérémy Côté,Canada,"Iron Hands, Kingambit, Landorus Therian, Iron Bundle, Flutter Mane, Wellspring Mask Ogerpon"
66,148,Ian McLaughlin,USA,"Rapid Strike Urshifu, Flutter Mane, Female Indeedee, Armarouge, Bloodmoon Ursaluna, Tornadus"
67,2808,Blooby B,USA,"Oranguru, Galarian Weezing, Cornerstone Mask Ogerpon, Female Indeedee, Armarouge, Bloodmoon Ursaluna"
68,1939,Olivia Moledzki,Canada,"Farigiraf, Rillaboom, Heatran, Chien-Pao, Rapid Strike Urshifu, Dragonite"
69,2809,Riley Stewart,Canada,"Iron Hands, Landorus Therian, Kingambit, Wellspring Mask Ogerpon, Chien-Pao, Flutter Mane"
70,2810,Daniel Reyes,USA,"Rapid Strike Urshifu, Farigiraf, Rillaboom, Dragonite, Heatran, Chien-Pao"
71,1728,Ryan Haig,USA,"Chi-Yu, Tatsugiri, Flutter Mane, Dragonite, Dondozo, Chien-Pao"
72,2811,Charles Moses,USA,"Rapid Strike Urshifu, Rillaboom, Heatran, Farigiraf, Dragonite, Chien-Pao"
73,663,Ben Grissmer,USA,"Female Indeedee, Single Strike Urshifu, Torkoal, Hearthflame Mask Ogerpon, Gallade, Armarouge"
74,2812,Braden Clemens,Canada,"Rapid Strike Urshifu, Flutter Mane, Chien-Pao, Wellspring Mask Ogerpon, Dragonite, Amoonguss"
75,1940,Joshua Denk,USA,"Hearthflame Mask Ogerpon, Dragonite, Rapid Strike Urshifu, Chien-Pao, Amoonguss, Kingambit"
76,382,Sohaib Mufti,USA,"Landorus Therian, Iron Bundle, Amoonguss, Heatran, Flutter Mane, Iron Hands"
77,1967,Lorenzo Arce,USA,"Arcanine, Chien-Pao, Basculegion, Roaring Moon, Ogerpon, Gholdengo"
78,2063,Abdullah Mohayyuddin,Canada,"Gholdengo, Tornadus, Iron Hands, Rapid Strike Urshifu, Wellspring Mask Ogerpon, Hisuian Arcanine"
79,198,James Baek,USA,"Rapid Strike Urshifu, Flutter Mane, Hisuian Arcanine, Tornadus, Chien-Pao, Rillaboom"
80,1695,Grant Laird,USA,"Farigiraf, Bloodmoon Ursaluna, Clefairy, Okidogi, Roaring Moon, Wellspring Mask Ogerpon"
81,1786,Steven Stark,USA,"Landorus Therian, Grimmsnarl, Iron Hands, Cresselia, Volcarona, Wellspring Mask Ogerpon"
82,2545,Andrew Whitman,USA,"Iron Hands, Rillaboom, Landorus Therian, Iron Bundle, Heatran, Hearthflame Mask Ogerpon"
83,1931,Ofomezie Emelle,USA,"Cresselia, Annihilape, Grimmsnarl, Hisuian Goodra, Hisuian Arcanine, Wellspring Mask Ogerpon"
84,2813,Jose Mena,Costa Rica,"Hearthflame Mask Ogerpon, Iron Hands, Flutter Mane, Landorus Therian, Farigiraf, Milotic"
85,2814,Luqun Shen,USA,"Dusclops, Bloodmoon Ursaluna, Galarian Moltres, Iron Hands, Sinistcha, Hisuian Arcanine"
86,199,Toler Webb,USA,"Grimmsnarl, Cresselia, Hisuian Arcanine, Hisuian Goodra, Wellspring Mask Ogerpon, Annihilape"
87,2815,Jinkyum Kim,Canada,"Rapid Strike Urshifu, Heatran, Flutter Mane, Rillaboom, Chien-Pao, Pikachu"
88,2816,David Baumgardt,USA,"Amoonguss, Chien-Pao, Rapid Strike Urshifu, Dragonite, Hisuian Arcanine, Gothitelle"
89,1088,Joseph Ugarte,USA,"Hisuian Arcanine, Iron Bundle, Okidogi, Wellspring Mask Ogerpon, Gholdengo, Grimmsnarl"
90,2370,Charles Dupont,Canada,"Cresselia, Wellspring Mask Ogerpon, Landorus Therian, Heatran, Alolan Ninetales, Iron Hands"
91,1805,Max Gelman,USA,"Alolan Ninetales, Iron Hands, Iron Bundle, Sinistcha, Heatran, Landorus Therian"
92,1058,Arbin Tumaneng,USA,"Armarouge, Single Strike Urshifu, Female Indeedee, Torkoal, Galarian Weezing, Flutter Mane"
93,2124,Robert Moore,USA,"Clefairy, Rillaboom, Hisuian Arcanine, Wellspring Mask Ogerpon, Flutter Mane, Roaring Moon"
94,2817,Brennan Clark,Canada,"Iron Bundle, Chi-Yu, Landorus Therian, Iron Hands, Amoonguss, Flutter Mane"
95,2312,Matin Moradi,USA,"Landorus Therian, Heatran, Sinistcha, Baxcalibur, Alolan Ninetales, Iron Hands"
96,2818,Joseph Thomas,USA,"Wellspring Mask Ogerpon, Heatran, Roaring Moon, Cresselia, Rillaboom, Iron Hands"
97,2819,Patrick Cheng,Hong Kong,"Torkoal, Gallade, Female Indeedee, Single Strike Urshifu, Ursaluna, Armarouge"
98,1871,Xiao Haotian,China,"Chi-Yu, Flutter Mane, Wellspring Mask Ogerpon, Landorus Therian, Rapid Strike Urshifu, Iron Hands"
99,657,Kyle Livinghouse,USA,"Iron Hands, Flutter Mane, Roaring Moon, Wellspring Mask Ogerpon, Weezing, Landorus Therian"
100,1938,Andrew Johnson,USA,"Rillaboom, Iron Bundle, Flutter Mane, Kommo-o, Tyranitar, Hisuian Arcanine"
101,342,Rajan Bal,USA,"Flutter Mane, Roaring Moon, Clefairy, Wellspring Mask Ogerpon, Hisuian Arcanine, Rillaboom"
102,1586,Eric Stuart,USA,"Heatran, Amoonguss, Flutter Mane, Roaring Moon, Landorus Therian, Iron Hands"
103,1066,Marco Hemantha Kaladura Silva,Italy,"Amoonguss, Roaring Moon, Heatran, Landorus Therian, Iron Hands, Flutter Mane"
104,1680,Luca Paz,USA,"Rapid Strike Urshifu, Hisuian Arcanine, Rillaboom, Tornadus, Chien-Pao, Flutter Mane"
105,2820,Jacob Gagnacci,Canada,"Rapid Strike Urshifu, Chien-Pao, Amoonguss, Tornadus, Flutter Mane, Hisuian Arcanine"
106,2821,Quaid Reynolds,Canada,"Amoonguss, Kommo-o, Landorus Therian, Tyranitar, Heatran, Rillaboom"
107,632,Yuanhao Li,USA,"Tornadus, Rillaboom, Rapid Strike Urshifu, Flutter Mane, Landorus Therian, Hearthflame Mask Ogerpon"
108,2822,kyle andrew,Canada,"Dondozo, Tatsugiri, Landorus Therian, Hearthflame Mask Ogerpon, Gholdengo, Fezandipiti"
109,2823,Charlie Pollock,USA,"Wellspring Mask Ogerpon, Heatran, Iron Hands, Kingambit, Landorus Therian, Flutter Mane"
110,2824,Aaron Jaffe,Canada,"Gyarados, Garganacl, Sinistcha, Iron Hands, Grimmsnarl, Glimmora"
111,2325,Olivia Maney,USA,"Volcarona, Wellspring Mask Ogerpon, Flutter Mane, Alolan Ninetales, Farigiraf, Rillaboom"
112,2825,Eric Luong,Canada,"Hisuian Arcanine, Flutter Mane, Ting-Lu, Clefairy, Rillaboom, Kommo-o"
113,2826,Jeffrey Ramsden,Canada,"Chien-Pao, Dragonite, Dondozo, Tatsugiri, Hisuian Arcanine, Amoonguss"
114,1676,Calvin Nisson,USA,"Iron Hands, Flutter Mane, Wellspring Mask Ogerpon, Landorus Therian, Chi-Yu, Kingambit"
115,2072,Luis Mendoza,El Salvador,"Weezing, Hisuian Arcanine, Roaring Moon, Rillaboom, Flutter Mane, Wellspring Mask Ogerpon"
116,311,Stephen Morioka,USA,"Rillaboom, Farigiraf, Rapid Strike Urshifu, Heatran, Chien-Pao, Dragonite"
117,2827,Mateo Vasic,USA,"Heatran, Chien-Pao, Landorus Therian, Iron Hands, Rillaboom, Cornerstone Mask Ogerpon"
118,1605,Jourdan Bul,USA,"Iron Hands, Landorus Therian, Flutter Mane, Heatran, Wellspring Mask Ogerpon, Roaring Moon"
119,2828,Dia Laidlaw,USA,"Rillaboom, Dragonite, Hearthflame Mask Ogerpon, Milotic, Flutter Mane, Chien-Pao"
120,2348,Timothy Bensema,USA,"Heatran, Landorus Therian, Iron Hands, Alolan Ninetales, Kingambit, Wellspring Mask Ogerpon"
121,411,Vincent Montalvo,USA,"Tornadus, Gholdengo, Iron Hands, Wellspring Mask Ogerpon, Cresselia, Hisuian Arcanine"
122,2829,Neale Maker,N/A,"Baxcalibur, Landorus Therian, Heatran, Wellspring Mask Ogerpon, Iron Hands, Alolan Ninetales"
123,2830,Nick Petrina,Canada,"Farigiraf, Tornadus, Bloodmoon Ursaluna, Flutter Mane, Rapid Strike Urshifu, Hearthflame Mask Ogerpon"
124,2225,Junxi Zhu,USA,"Rillaboom, Flutter Mane, Hisuian Arcanine, Hearthflame Mask Ogerpon, Tornadus, Gastrodon"
125,1892,Yotam Cohen,USA,"Chien-Pao, Rapid Strike Urshifu, Tornadus, Hisuian Arcanine, Rillaboom, Flutter Mane"
126,1637,Tyson Gernack,Canada,"Iron Hands, Landorus Therian, Dusclops, Chi-Yu, Wellspring Mask Ogerpon, Bloodmoon Ursaluna"
127,2831,Will Evans,Canada,"Gholdengo, Rapid Strike Urshifu, Regidrago, Flutter Mane, Illumise, Rillaboom"
128,2832,Alex Lindoro,Mexico,"Iron Hands, Kingambit, Landorus Therian, Sinistcha, Flutter Mane, Roaring Moon"
